{
  "event": "graph.tag.updated:v1",
  "graphId": "operations/incident-response",
  "tenantId": "default",
  "traceId": "trace-graph-tag-delete-001",
  "ts": "2025-01-10T04:12:00Z",
  "action": "delete",
  "tag": {
    "key": "severity"
  },
  "actor": {
    "type": "system",
    "id": "operate-ui",
    "displayName": "Operate UI"
  }
}
